"id:ID","instanceType","label","text","purpose","description","name","uuid","id"
"750","ENDPOINT","","Alzheimer's Disease Assessment Scale - Cognitive Subscale, total of 11 items [ADAS-Cog (11)] at Week 24","","","END1","3182f665-76fa-4280-b966-81fa4fdf2583","Endpoint_1"
"751","ENDPOINT","","Video-referenced Clinician’s Interview-based Impression of Change (CIBIC+) at Week 24","","","END2","3e20b66c-8ef4-468c-92ad-e5f6b50a7258","Endpoint_2"
"752","ENDPOINT","","Adverse events","","","END3","271fed81-cb08-40b8-acea-e8ba57edd96b","Endpoint_3"
"753","ENDPOINT","","Vital signs (weight, standing and supine blood pressure, heart rate)","","","END4","8d6054ed-0fba-455d-b7d5-576bd84aba10","Endpoint_4"
"754","ENDPOINT","","Laboratory evaluations (Change from Baseline)","","The change from baseline laboratory value will be  calculated as the difference between the baseline lab value and the endpoint value (i.e., the value at the specified visit) or the end of treatment observation","END5","6e40711b-db25-4beb-8b38-0c1854519f1a","Endpoint_5"
"755","ENDPOINT","","Alzheimer's Disease Assessment Scale - Cognitive Subscale, total of 11 items [ADAS-Cog (11)] at Weeks 8 and 16","","","END6","309237fe-4b71-4f2f-90ea-5fa90879a53d","Endpoint_6"
"756","ENDPOINT","","Video-referenced Clinician’s Interview-based Impression of Change (CIBIC+) at Weeks 8 and 16","","","END7","123663f6-89e2-4c75-8964-3d508c14c88a","Endpoint_7"
"757","ENDPOINT","","Mean Revised Neuropsychiatric Inventory (NPI-X) from Week 4 to Week 24","","","END8","eb44a237-7c25-402e-a224-6684fa94f401","Endpoint_8"
